No.,Time,Absolute_Time,Source,Destination,Protocol,Length,Info
1,0.0,2024-08-15 00:09:00.000,0.0.0.0,255.255.255.255,DHCP,383,DHCP Request  - Transaction ID 0xf96e0aac
2,0.000755,2024-08-15 00:09:00.000,10.8.15.4,255.255.255.255,DHCP,342,DHCP NAK      - Transaction ID 0xf96e0aac
3,0.010733,2024-08-15 00:09:00.010,0.0.0.0,255.255.255.255,DHCP,342,DHCP Discover - Transaction ID 0x29b669b8
4,0.011654,2024-08-15 00:09:00.011,10.8.15.4,255.255.255.255,DHCP,353,DHCP Offer    - Transaction ID 0x29b669b8
5,0.023612,2024-08-15 00:09:00.023,0.0.0.0,255.255.255.255,DHCP,389,DHCP Request  - Transaction ID 0x29b669b8
6,0.02423,2024-08-15 00:09:00.024,10.8.15.4,255.255.255.255,DHCP,358,DHCP ACK      - Transaction ID 0x29b669b8
7,0.039631,2024-08-15 00:09:00.039,Intel_03:54:82,Broadcast,ARP,42,Who has 10.8.15.1? Tell 10.8.15.133
8,0.039716,2024-08-15 00:09:00.039,Cisco_02:a7:4b,Intel_03:54:82,ARP,42,10.8.15.1 is at 00:16:9c:02:a7:4b
9,0.048765,2024-08-15 00:09:00.048,10.8.15.133,224.0.0.22,IGMPv3,54,Membership Report / Join group 224.0.0.251 for any sources
10,0.05777,2024-08-15 00:09:00.057,Intel_03:54:82,Broadcast,ARP,42,Who has 10.8.15.133? (ARP Probe)
11,0.057853,2024-08-15 00:09:00.057,10.8.15.133,224.0.0.22,IGMPv3,54,Membership Report / Join group 224.0.0.251 for any sources
12,0.07237,2024-08-15 00:09:00.072,10.8.15.133,224.0.0.22,IGMPv3,54,Membership Report / Join group 224.0.0.252 for any sources
13,0.077461,2024-08-15 00:09:00.077,10.8.15.133,224.0.0.22,IGMPv3,54,Membership Report / Leave group 224.0.0.252
14,0.077704,2024-08-15 00:09:00.077,10.8.15.133,224.0.0.22,IGMPv3,54,Membership Report / Join group 224.0.0.252 for any sources
15,0.079539,2024-08-15 00:09:00.079,10.8.15.133,224.0.0.251,MDNS,81,"Standard query 0x0000 ANY DESKTOP-H8ALZBV.local, ""QM"" question"
16,0.079799,2024-08-15 00:09:00.079,10.8.15.133,224.0.0.251,MDNS,91,Standard query response 0x0000 A 10.8.15.133
17,0.081786,2024-08-15 00:09:00.081,10.8.15.133,224.0.0.252,LLMNR,75,Standard query 0x67ad ANY DESKTOP-H8ALZBV
18,0.358379,2024-08-15 00:09:00.358,Intel_03:54:82,Broadcast,ARP,42,Who has 10.8.15.4? Tell 10.8.15.133
19,0.358694,2024-08-15 00:09:00.358,Dell_8c:9c:40,Intel_03:54:82,ARP,42,10.8.15.4 is at 64:00:6a:8c:9c:40
20,0.358829,2024-08-15 00:09:00.358,10.8.15.133,10.8.15.4,DNS,99,Standard query 0xa098 SRV _ldap._tcp.dc._msdcs.lafontainebleu.org
21,0.359155,2024-08-15 00:09:00.359,10.8.15.4,10.8.15.133,DNS,169,Standard query response 0xa098 SRV _ldap._tcp.dc._msdcs.lafontainebleu.org SRV 0 100 389 win-jegjix7q9rs.lafontainebleu.org A 10.8.15.4
22,0.381043,2024-08-15 00:09:00.381,10.8.15.133,10.8.15.4,DNS,94,Standard query 0xcf32 A win-jegjix7q9rs.lafontainebleu.org
23,0.381332,2024-08-15 00:09:00.381,10.8.15.4,10.8.15.133,DNS,110,Standard query response 0xcf32 A win-jegjix7q9rs.lafontainebleu.org A 10.8.15.4
24,0.390455,2024-08-15 00:09:00.390,10.8.15.133,10.8.15.4,CLDAP,272,"searchRequest(1) ""<ROOT>"" baseObject "
25,0.390729,2024-08-15 00:09:00.390,Intel_03:54:82,Broadcast,ARP,42,Who has 10.8.15.1? Tell 10.8.15.133
26,0.390849,2024-08-15 00:09:00.390,Cisco_02:a7:4b,Intel_03:54:82,ARP,42,10.8.15.1 is at 00:16:9c:02:a7:4b
27,0.390907,2024-08-15 00:09:00.390,10.8.15.4,10.8.15.133,CLDAP,248,"searchResEntry(1) ""<ROOT>"" searchResDone(1) success  [1 result]"
28,0.413675,2024-08-15 00:09:00.413,Intel_03:54:82,Broadcast,ARP,42,Who has 10.8.15.1? Tell 10.8.15.133
29,0.413799,2024-08-15 00:09:00.413,Cisco_02:a7:4b,Intel_03:54:82,ARP,42,10.8.15.1 is at 00:16:9c:02:a7:4b
30,0.437265,2024-08-15 00:09:00.437,10.8.15.133,10.8.15.255,NBNS,110,Registration NB DESKTOP-H8ALZBV<00>
31,0.437739,2024-08-15 00:09:00.437,10.8.15.133,10.8.15.255,NBNS,110,Registration NB LAFONTAINEBLEU<00>
32,0.50984,2024-08-15 00:09:00.509,10.8.15.133,10.8.15.4,DNS,99,Standard query 0xbfe0 SRV _ldap._tcp.dc._msdcs.lafontainebleu.org
33,0.510398,2024-08-15 00:09:00.510,10.8.15.4,10.8.15.133,DNS,169,Standard query response 0xbfe0 SRV _ldap._tcp.dc._msdcs.lafontainebleu.org SRV 0 100 389 win-jegjix7q9rs.lafontainebleu.org A 10.8.15.4
34,0.511615,2024-08-15 00:09:00.511,10.8.15.133,10.8.15.4,TCP,66,49667  >  389 [SYN] Seq=0 Win=64240 Len=0 MSS=1460 WS=256 SACK_PERM
35,0.511756,2024-08-15 00:09:00.511,10.8.15.4,10.8.15.133,TCP,66,"389  >  49667 [SYN, ACK] Seq=0 Ack=1 Win=65535 Len=0 MSS=1460 WS=256 SACK_PERM"
36,0.511849,2024-08-15 00:09:00.511,10.8.15.133,10.8.15.4,TCP,54,49667  >  389 [ACK] Seq=1 Ack=1 Win=262656 Len=0
37,0.512013,2024-08-15 00:09:00.512,10.8.15.133,10.8.15.4,LDAP,404,"searchRequest(2) ""<ROOT>"" baseObject "
38,0.512296,2024-08-15 00:09:00.512,10.8.15.4,10.8.15.133,TCP,1514,389  >  49667 [ACK] Seq=1 Ack=351 Win=2097664 Len=1460 [TCP PDU reassembled in 39]
39,0.512299,2024-08-15 00:09:00.512,10.8.15.4,10.8.15.133,LDAP,1435,"searchResEntry(2) ""<ROOT>""  | searchResDone(2) success  [1 result]"
40,0.512422,2024-08-15 00:09:00.512,10.8.15.133,10.8.15.4,TCP,54,49667  >  389 [ACK] Seq=351 Ack=2842 Win=262656 Len=0
41,0.531446,2024-08-15 00:09:00.531,10.8.15.133,10.8.15.4,CLDAP,272,"searchRequest(4) ""<ROOT>"" baseObject "
42,0.531813,2024-08-15 00:09:00.531,10.8.15.4,10.8.15.133,CLDAP,248,"searchResEntry(4) ""<ROOT>"" searchResDone(4) success  [1 result]"
43,0.557871,2024-08-15 00:09:00.557,10.8.15.133,224.0.0.22,IGMPv3,54,Membership Report / Join group 224.0.0.252 for any sources
44,0.562469,2024-08-15 00:09:00.562,10.8.15.133,10.8.15.4,CLDAP,272,"searchRequest(1) ""<ROOT>"" baseObject "
45,0.562835,2024-08-15 00:09:00.562,10.8.15.4,10.8.15.133,CLDAP,248,"searchResEntry(1) ""<ROOT>"" searchResDone(1) success  [1 result]"
46,0.780795,2024-08-15 00:09:00.780,10.8.15.133,10.8.15.4,TCP,66,49670  >  445 [SYN] Seq=0 Win=64240 Len=0 MSS=1460 WS=256 SACK_PERM
47,0.781036,2024-08-15 00:09:00.781,10.8.15.4,10.8.15.133,TCP,66,"445  >  49670 [SYN, ACK] Seq=0 Ack=1 Win=65535 Len=0 MSS=1460 WS=256 SACK_PERM"
48,0.781197,2024-08-15 00:09:00.781,10.8.15.133,10.8.15.4,TCP,54,49670  >  445 [ACK] Seq=1 Ack=1 Win=262656 Len=0
49,0.799059,2024-08-15 00:09:00.799,10.8.15.133,10.8.15.4,SMB,127,Negotiate Protocol Request
50,0.799546,2024-08-15 00:09:00.799,10.8.15.4,10.8.15.133,SMB2,306,Negotiate Protocol Response
51,0.799724,2024-08-15 00:09:00.799,10.8.15.133,10.8.15.4,SMB2,382,Negotiate Protocol Request
52,0.800022,2024-08-15 00:09:00.800,10.8.15.4,10.8.15.133,SMB2,430,Negotiate Protocol Response
53,0.854665,2024-08-15 00:09:00.854,10.8.15.133,10.8.15.4,TCP,54,49670  >  445 [ACK] Seq=402 Ack=629 Win=262144 Len=0
54,1.058768,2024-08-15 00:09:01.058,Intel_03:54:82,Broadcast,ARP,42,Who has 10.8.15.133? (ARP Probe)
55,1.173944,2024-08-15 00:09:01.173,10.8.15.133,10.8.15.4,DNS,83,Standard query 0xd296 A wpad.lafontainebleu.org
56,1.174242,2024-08-15 00:09:01.174,10.8.15.4,10.8.15.133,DNS,164,Standard query response 0xd296 No such name A wpad.lafontainebleu.org SOA win-jegjix7q9rs.lafontainebleu.org
57,1.183796,2024-08-15 00:09:01.183,10.8.15.133,10.8.15.255,NBNS,110,Registration NB LAFONTAINEBLEU<00>
58,1.183936,2024-08-15 00:09:01.183,10.8.15.133,10.8.15.255,NBNS,110,Registration NB DESKTOP-H8ALZBV<00>
59,1.191808,2024-08-15 00:09:01.191,10.8.15.133,10.8.15.4,DNS,83,Standard query 0x238f A wpad.lafontainebleu.org
60,1.192079,2024-08-15 00:09:01.192,10.8.15.4,10.8.15.133,DNS,164,Standard query response 0x238f No such name A wpad.lafontainebleu.org SOA win-jegjix7q9rs.lafontainebleu.org
61,1.21787,2024-08-15 00:09:01.217,10.8.15.133,10.8.15.4,DNS,83,Standard query 0xf65f A www.msftconnecttest.com
62,1.26031,2024-08-15 00:09:01.260,10.8.15.4,10.8.15.133,DNS,227,Standard query response 0xf65f A www.msftconnecttest.com CNAME ncsi-geo.trafficmanager.net CNAME www.msftncsi.com.edgesuite.net CNAME a1961.g2.akamai.net A 23.205.110.48 A 23.205.110.62
63,1.290524,2024-08-15 00:09:01.290,10.8.15.133,23.205.110.48,TCP,66,49671  >  80 [SYN] Seq=0 Win=64240 Len=0 MSS=1460 WS=256 SACK_PERM
64,1.319973,2024-08-15 00:09:01.319,23.205.110.48,10.8.15.133,TCP,58,"80  >  49671 [SYN, ACK] Seq=0 Ack=1 Win=64240 Len=0 MSS=1460"
65,1.320139,2024-08-15 00:09:01.320,10.8.15.133,23.205.110.48,TCP,54,49671  >  80 [ACK] Seq=1 Ack=1 Win=64240 Len=0
66,1.320472,2024-08-15 00:09:01.320,10.8.15.133,23.205.110.48,HTTP,165,GET /connecttest.txt HTTP/1.1 
67,1.32055,2024-08-15 00:09:01.320,23.205.110.48,10.8.15.133,TCP,54,80  >  49671 [ACK] Seq=1 Ack=112 Win=64240 Len=0
68,1.361053,2024-08-15 00:09:01.361,23.205.110.48,10.8.15.133,HTTP,241,HTTP/1.1 200 OK  (text/plain)
69,1.361218,2024-08-15 00:09:01.361,10.8.15.133,23.205.110.48,TCP,54,49671  >  80 [ACK] Seq=112 Ack=189 Win=64053 Len=0
70,1.373514,2024-08-15 00:09:01.373,10.8.15.133,23.205.110.48,TCP,54,"49671  >  80 [FIN, ACK] Seq=112 Ack=189 Win=64053 Len=0"
71,1.373654,2024-08-15 00:09:01.373,23.205.110.48,10.8.15.133,TCP,54,80  >  49671 [ACK] Seq=189 Ack=113 Win=64239 Len=0
72,1.500263,2024-08-15 00:09:01.500,10.8.15.133,10.8.15.4,DNS,76,Standard query 0x8ca2 A go.microsoft.com
73,1.540676,2024-08-15 00:09:01.540,10.8.15.4,10.8.15.133,DNS,171,Standard query response 0x8ca2 A go.microsoft.com CNAME go.microsoft.com.edgekey.net CNAME e11290.dspg.akamaiedge.net A 23.33.138.184
74,1.571317,2024-08-15 00:09:01.571,10.8.15.133,23.33.138.184,TCP,66,49672  >  443 [SYN] Seq=0 Win=64240 Len=0 MSS=1460 WS=256 SACK_PERM
75,1.63049,2024-08-15 00:09:01.630,23.33.138.184,10.8.15.133,TCP,58,"443  >  49672 [SYN, ACK] Seq=0 Ack=1 Win=64240 Len=0 MSS=1460"
76,1.630641,2024-08-15 00:09:01.630,10.8.15.133,23.33.138.184,TCP,54,49672  >  443 [ACK] Seq=1 Ack=1 Win=64240 Len=0
77,1.675321,2024-08-15 00:09:01.675,10.8.15.133,23.33.138.184,TLSv1.3,344,Client Hello (SNI=go.microsoft.com)
78,1.675467,2024-08-15 00:09:01.675,23.33.138.184,10.8.15.133,TCP,54,443  >  49672 [ACK] Seq=1 Ack=291 Win=64240 Len=0
79,1.732047,2024-08-15 00:09:01.732,23.33.138.184,10.8.15.133,TLSv1.3,1418,"Server Hello, Change Cipher Spec, Application Data"
80,1.738457,2024-08-15 00:09:01.738,23.33.138.184,10.8.15.133,TCP,1514,443  >  49672 [ACK] Seq=1365 Ack=291 Win=64240 Len=1460 [TCP PDU reassembled in 84]
81,1.73846,2024-08-15 00:09:01.738,23.33.138.184,10.8.15.133,TCP,1326,"443  >  49672 [PSH, ACK] Seq=2825 Ack=291 Win=64240 Len=1272 [TCP PDU reassembled in 84]"
82,1.746473,2024-08-15 00:09:01.746,10.8.15.133,23.33.138.184,TCP,54,49672  >  443 [ACK] Seq=291 Ack=4097 Win=64240 Len=0
83,1.782909,2024-08-15 00:09:01.782,23.33.138.184,10.8.15.133,TCP,1514,443  >  49672 [ACK] Seq=4097 Ack=291 Win=64240 Len=1460 [TCP PDU reassembled in 84]
84,1.782912,2024-08-15 00:09:01.782,23.33.138.184,10.8.15.133,TLSv1.3,551,"Application Data, Application Data, Application Data"
85,1.784868,2024-08-15 00:09:01.784,10.8.15.133,23.33.138.184,TCP,54,49672  >  443 [ACK] Seq=291 Ack=6054 Win=64240 Len=0
86,1.81207,2024-08-15 00:09:01.812,10.8.15.133,23.33.138.184,TLSv1.3,134,"Change Cipher Spec, Application Data"
87,1.812239,2024-08-15 00:09:01.812,23.33.138.184,10.8.15.133,TCP,54,443  >  49672 [ACK] Seq=6054 Ack=371 Win=64240 Len=0
88,1.816245,2024-08-15 00:09:01.816,10.8.15.133,23.33.138.184,TLSv1.3,423,Application Data
89,1.81629,2024-08-15 00:09:01.816,10.8.15.133,23.33.138.184,TLSv1.3,1496,Application Data
90,1.816318,2024-08-15 00:09:01.816,23.33.138.184,10.8.15.133,TCP,54,443  >  49672 [ACK] Seq=6054 Ack=740 Win=64240 Len=0
91,1.816391,2024-08-15 00:09:01.816,23.33.138.184,10.8.15.133,TCP,54,443  >  49672 [ACK] Seq=6054 Ack=2182 Win=64240 Len=0
92,1.870812,2024-08-15 00:09:01.870,23.33.138.184,10.8.15.133,TLSv1.3,628,"Application Data, Application Data"
93,1.879951,2024-08-15 00:09:01.879,23.33.138.184,10.8.15.133,TLSv1.3,799,Application Data
94,1.880134,2024-08-15 00:09:01.880,10.8.15.133,23.33.138.184,TCP,54,49672  >  443 [ACK] Seq=2182 Ack=7373 Win=62921 Len=0
95,1.881934,2024-08-15 00:09:01.881,23.33.138.184,10.8.15.133,TLSv1.3,78,Application Data
96,1.88216,2024-08-15 00:09:01.882,23.33.138.184,10.8.15.133,TCP,54,"443  >  49672 [FIN, PSH, ACK] Seq=7397 Ack=2182 Win=64240 Len=0"
97,1.884961,2024-08-15 00:09:01.884,10.8.15.133,23.33.138.184,TCP,54,49672  >  443 [ACK] Seq=2182 Ack=7398 Win=62897 Len=0
98,1.887208,2024-08-15 00:09:01.887,10.8.15.133,23.33.138.184,TLSv1.3,78,Application Data
99,1.88727,2024-08-15 00:09:01.887,10.8.15.133,23.33.138.184,TCP,54,"49672  >  443 [FIN, ACK] Seq=2206 Ack=7398 Win=62897 Len=0"
100,1.887289,2024-08-15 00:09:01.887,23.33.138.184,10.8.15.133,TCP,54,443  >  49672 [ACK] Seq=7398 Ack=2206 Win=64240 Len=0
101,1.887318,2024-08-15 00:09:01.887,23.33.138.184,10.8.15.133,TCP,54,443  >  49672 [ACK] Seq=7398 Ack=2207 Win=64239 Len=0
102,1.904872,2024-08-15 00:09:01.904,10.8.15.133,23.33.138.184,TCP,66,49673  >  443 [SYN] Seq=0 Win=64240 Len=0 MSS=1460 WS=256 SACK_PERM
103,1.935503,2024-08-15 00:09:01.935,10.8.15.133,10.8.15.255,NBNS,110,Registration NB LAFONTAINEBLEU<00>
104,1.935565,2024-08-15 00:09:01.935,10.8.15.133,10.8.15.255,NBNS,110,Registration NB DESKTOP-H8ALZBV<00>
105,1.954357,2024-08-15 00:09:01.954,23.33.138.184,10.8.15.133,TCP,58,"443  >  49673 [SYN, ACK] Seq=0 Ack=1 Win=64240 Len=0 MSS=1460"
106,1.965163,2024-08-15 00:09:01.965,10.8.15.133,23.33.138.184,TCP,54,49673  >  443 [ACK] Seq=1 Ack=1 Win=64240 Len=0
107,1.995298,2024-08-15 00:09:01.995,10.8.15.133,23.33.138.184,TLSv1.3,647,Client Hello (SNI=go.microsoft.com)
108,1.995452,2024-08-15 00:09:01.995,23.33.138.184,10.8.15.133,TCP,54,443  >  49673 [ACK] Seq=1 Ack=594 Win=64240 Len=0
109,2.056015,2024-08-15 00:09:02.056,23.33.138.184,10.8.15.133,TLSv1.3,324,"Server Hello, Change Cipher Spec, Application Data, Application Data"
110,2.114931,2024-08-15 00:09:02.114,10.8.15.133,10.8.15.4,DNS,130,Standard query 0xbe5f SRV _ldap._tcp.Default-First-Site-Name._sites.dc._msdcs.lafontainebleu.org
111,2.115215,2024-08-15 00:09:02.115,10.8.15.4,10.8.15.133,DNS,200,Standard query response 0xbe5f SRV _ldap._tcp.Default-First-Site-Name._sites.dc._msdcs.lafontainebleu.org SRV 0 100 389 win-jegjix7q9rs.lafontainebleu.org A 10.8.15.4
112,2.127924,2024-08-15 00:09:02.127,Intel_03:54:82,Broadcast,ARP,42,Who has 10.8.15.133? (ARP Probe)
113,2.128034,2024-08-15 00:09:02.128,10.8.15.133,23.33.138.184,TCP,54,49673  >  443 [ACK] Seq=594 Ack=271 Win=63970 Len=0
114,2.145622,2024-08-15 00:09:02.145,10.8.15.133,10.8.15.4,DNS,134,Standard query 0x2c47 SRV _kerberos._tcp.Default-First-Site-Name._sites.dc._msdcs.lafontainebleu.org
115,2.145915,2024-08-15 00:09:02.145,10.8.15.4,10.8.15.133,DNS,204,Standard query response 0x2c47 SRV _kerberos._tcp.Default-First-Site-Name._sites.dc._msdcs.lafontainebleu.org SRV 0 100 88 win-jegjix7q9rs.lafontainebleu.org A 10.8.15.4
116,2.147297,2024-08-15 00:09:02.147,10.8.15.133,23.33.138.184,TLSv1.3,134,"Change Cipher Spec, Application Data"
117,2.147427,2024-08-15 00:09:02.147,23.33.138.184,10.8.15.133,TCP,54,443  >  49673 [ACK] Seq=271 Ack=674 Win=64240 Len=0
118,2.14752,2024-08-15 00:09:02.147,10.8.15.133,23.33.138.184,TLSv1.3,423,Application Data
119,2.147561,2024-08-15 00:09:02.147,10.8.15.133,23.33.138.184,TLSv1.3,1500,Application Data
120,2.147584,2024-08-15 00:09:02.147,23.33.138.184,10.8.15.133,TCP,54,443  >  49673 [ACK] Seq=271 Ack=1043 Win=64240 Len=0
121,2.147643,2024-08-15 00:09:02.147,23.33.138.184,10.8.15.133,TCP,54,443  >  49673 [ACK] Seq=271 Ack=2489 Win=64240 Len=0
122,2.149377,2024-08-15 00:09:02.149,10.8.15.133,10.8.15.4,CLDAP,319,"searchRequest(1) ""<ROOT>"" baseObject "
123,2.149763,2024-08-15 00:09:02.149,10.8.15.4,10.8.15.133,CLDAP,265,"searchResEntry(1) ""<ROOT>"" searchResDone(1) success  [6 results]"
124,2.171895,2024-08-15 00:09:02.171,10.8.15.133,10.8.15.4,DNS,134,Standard query 0xe024 SRV _kerberos._tcp.Default-First-Site-Name._sites.dc._msdcs.lafontainebleu.org
125,2.17214,2024-08-15 00:09:02.172,10.8.15.4,10.8.15.133,DNS,204,Standard query response 0xe024 SRV _kerberos._tcp.Default-First-Site-Name._sites.dc._msdcs.lafontainebleu.org SRV 0 100 88 win-jegjix7q9rs.lafontainebleu.org A 10.8.15.4
126,2.17225,2024-08-15 00:09:02.172,10.8.15.133,10.8.15.4,CLDAP,316,"searchRequest(2) ""<ROOT>"" baseObject "
127,2.172362,2024-08-15 00:09:02.172,10.8.15.133,10.8.15.4,CLDAP,273,"searchRequest(3) ""<ROOT>"" baseObject "
128,2.172568,2024-08-15 00:09:02.172,10.8.15.4,10.8.15.133,CLDAP,248,"searchResEntry(2) ""<ROOT>"" searchResDone(2) success  [6 results]"
129,2.172569,2024-08-15 00:09:02.172,10.8.15.133,10.8.15.4,CLDAP,272,"searchRequest(4) ""<ROOT>"" baseObject "
130,2.172613,2024-08-15 00:09:02.172,10.8.15.4,10.8.15.133,CLDAP,248,"searchResEntry(3) ""<ROOT>"" searchResDone(3) success  [6 results]"
131,2.172763,2024-08-15 00:09:02.172,10.8.15.4,10.8.15.133,CLDAP,248,"searchResEntry(4) ""<ROOT>"" searchResDone(4) success  [6 results]"
132,2.19156,2024-08-15 00:09:02.191,10.8.15.133,10.8.15.4,CLDAP,272,"searchRequest(5) ""<ROOT>"" baseObject "
133,2.191851,2024-08-15 00:09:02.191,10.8.15.4,10.8.15.133,CLDAP,248,"searchResEntry(5) ""<ROOT>"" searchResDone(5) success  [6 results]"
134,2.218779,2024-08-15 00:09:02.218,23.33.138.184,10.8.15.133,TLSv1.3,1110,"Application Data, Application Data, Application Data"
135,2.222533,2024-08-15 00:09:02.222,10.8.15.133,23.33.138.184,TCP,54,49673  >  443 [ACK] Seq=2489 Ack=1328 Win=62914 Len=0
136,2.257577,2024-08-15 00:09:02.257,10.8.15.133,10.8.15.4,CLDAP,273,"searchRequest(6) ""<ROOT>"" baseObject "
137,2.257901,2024-08-15 00:09:02.257,10.8.15.4,10.8.15.133,CLDAP,248,"searchResEntry(6) ""<ROOT>"" searchResDone(6) success  [6 results]"
138,2.286365,2024-08-15 00:09:02.286,10.8.15.133,10.8.15.4,TCP,66,49676  >  88 [SYN] Seq=0 Win=64240 Len=0 MSS=1460 WS=256 SACK_PERM
139,2.286599,2024-08-15 00:09:02.286,10.8.15.4,10.8.15.133,TCP,66,"88  >  49676 [SYN, ACK] Seq=0 Ack=1 Win=65535 Len=0 MSS=1460 WS=256 SACK_PERM"
140,2.28724,2024-08-15 00:09:02.287,10.8.15.133,10.8.15.4,TCP,66,49677  >  135 [SYN] Seq=0 Win=64240 Len=0 MSS=1460 WS=256 SACK_PERM
141,2.28754,2024-08-15 00:09:02.287,10.8.15.4,10.8.15.133,TCP,66,"135  >  49677 [SYN, ACK] Seq=0 Ack=1 Win=65535 Len=0 MSS=1460 WS=256 SACK_PERM"
142,2.287757,2024-08-15 00:09:02.287,10.8.15.133,10.8.15.4,TCP,66,49678  >  135 [SYN] Seq=0 Win=64240 Len=0 MSS=1460 WS=256 SACK_PERM
143,2.288017,2024-08-15 00:09:02.288,10.8.15.4,10.8.15.133,TCP,66,"135  >  49678 [SYN, ACK] Seq=0 Ack=1 Win=65535 Len=0 MSS=1460 WS=256 SACK_PERM"
144,2.290228,2024-08-15 00:09:02.290,10.8.15.133,23.33.138.184,TLSv1.3,78,Application Data
145,2.290256,2024-08-15 00:09:02.290,10.8.15.133,23.33.138.184,TCP,54,"49673  >  443 [FIN, ACK] Seq=2513 Ack=1328 Win=62914 Len=0"
146,2.290349,2024-08-15 00:09:02.290,23.33.138.184,10.8.15.133,TCP,54,443  >  49673 [ACK] Seq=1328 Ack=2513 Win=64240 Len=0
147,2.290381,2024-08-15 00:09:02.290,23.33.138.184,10.8.15.133,TCP,54,443  >  49673 [ACK] Seq=1328 Ack=2514 Win=64239 Len=0
148,2.295137,2024-08-15 00:09:02.295,10.8.15.133,10.8.15.4,TCP,54,49676  >  88 [ACK] Seq=1 Ack=1 Win=262656 Len=0
149,2.295161,2024-08-15 00:09:02.295,10.8.15.133,10.8.15.4,TCP,54,49677  >  135 [ACK] Seq=1 Ack=1 Win=262656 Len=0
150,2.295199,2024-08-15 00:09:02.295,10.8.15.133,10.8.15.4,TCP,54,49678  >  135 [ACK] Seq=1 Ack=1 Win=262656 Len=0
151,2.29539,2024-08-15 00:09:02.295,10.8.15.133,10.8.15.4,KRB5,306,AS-REQ
152,2.295832,2024-08-15 00:09:02.295,10.8.15.4,10.8.15.133,KRB5,294,KRB Error: KRB5KDC_ERR_PREAUTH_REQUIRED
153,2.296163,2024-08-15 00:09:02.296,10.8.15.133,10.8.15.4,TCP,54,"49676  >  88 [FIN, ACK] Seq=253 Ack=241 Win=262400 Len=0"
154,2.296266,2024-08-15 00:09:02.296,10.8.15.133,10.8.15.4,DCERPC,214,"Bind: call_id: 2, Fragment: Single, 3 context items: EPMv4 V3.0 (32bit NDR), EPMv4 V3.0 (64bit NDR), EPMv4 V3.0 (6cb71c2c-9812-4540-0300-000000000000)"
155,2.296306,2024-08-15 00:09:02.296,10.8.15.4,10.8.15.133,TCP,54,88  >  49676 [ACK] Seq=241 Ack=254 Win=2097664 Len=0
156,2.296439,2024-08-15 00:09:02.296,10.8.15.4,10.8.15.133,TCP,54,"88  >  49676 [RST, ACK] Seq=241 Ack=254 Win=0 Len=0"
157,2.296517,2024-08-15 00:09:02.296,10.8.15.4,10.8.15.133,DCERPC,162,"Bind_ack: call_id: 2, Fragment: Single, max_xmit: 5840 max_recv: 5840, 3 results: Provider rejection, Acceptance, Negotiate ACK"
158,2.301058,2024-08-15 00:09:02.301,10.8.15.133,10.8.15.4,EPM,222,"Map request, DRSUAPI, 32bit NDR"
159,2.301099,2024-08-15 00:09:02.301,10.8.15.133,10.8.15.4,DCERPC,214,"Bind: call_id: 3, Fragment: Single, 2 context items: EPMv4 V3.0 (32bit NDR), EPMv4 V3.0 (64bit NDR)"
160,2.301229,2024-08-15 00:09:02.301,10.8.15.4,10.8.15.133,DCERPC,138,"Bind_ack: call_id: 3, Fragment: Single, max_xmit: 5840 max_recv: 5840, 2 results: Provider rejection, Acceptance"
161,2.301255,2024-08-15 00:09:02.301,10.8.15.133,10.8.15.4,TCP,66,49679  >  88 [SYN] Seq=0 Win=64240 Len=0 MSS=1460 WS=256 SACK_PERM
162,2.30139,2024-08-15 00:09:02.301,10.8.15.4,10.8.15.133,TCP,66,"88  >  49679 [SYN, ACK] Seq=0 Ack=1 Win=65535 Len=0 MSS=1460 WS=256 SACK_PERM"
163,2.301547,2024-08-15 00:09:02.301,10.8.15.4,10.8.15.133,EPM,322,"Map response, DRSUAPI, 32bit NDR, DRSUAPI, 32bit NDR"
164,2.305287,2024-08-15 00:09:02.305,10.8.15.133,10.8.15.4,TCP,66,49680  >  88 [SYN] Seq=0 Win=64240 Len=0 MSS=1460 WS=256 SACK_PERM
165,2.305432,2024-08-15 00:09:02.305,10.8.15.4,10.8.15.133,TCP,66,"88  >  49680 [SYN, ACK] Seq=0 Ack=1 Win=65535 Len=0 MSS=1460 WS=256 SACK_PERM"
166,2.305799,2024-08-15 00:09:02.305,10.8.15.133,10.8.15.4,KRB5,306,AS-REQ
167,2.305816,2024-08-15 00:09:02.305,10.8.15.133,10.8.15.4,TCP,54,49680  >  88 [ACK] Seq=1 Ack=1 Win=262656 Len=0
168,2.306025,2024-08-15 00:09:02.306,10.8.15.133,10.8.15.4,EPM,222,"Map request, RPC_NETLOGON, 32bit NDR"
169,2.306082,2024-08-15 00:09:02.306,10.8.15.133,10.8.15.4,KRB5,386,AS-REQ
170,2.306838,2024-08-15 00:09:02.306,10.8.15.4,10.8.15.133,KRB5,294,KRB Error: KRB5KDC_ERR_PREAUTH_REQUIRED
171,2.307166,2024-08-15 00:09:02.307,10.8.15.4,10.8.15.133,EPM,418,"Map response, RPC_NETLOGON, 32bit NDR, RPC_NETLOGON, 32bit NDR, RPC_NETLOGON, 32bit NDR"
172,2.307308,2024-08-15 00:09:02.307,10.8.15.4,10.8.15.133,TCP,1514,88  >  49680 [ACK] Seq=1 Ack=333 Win=2097664 Len=1460 [TCP PDU reassembled in 173]
173,2.307311,2024-08-15 00:09:02.307,10.8.15.4,10.8.15.133,KRB5,437,AS-REP
174,2.307651,2024-08-15 00:09:02.307,10.8.15.133,10.8.15.4,TCP,54,"49679  >  88 [FIN, ACK] Seq=253 Ack=241 Win=262400 Len=0"
175,2.307672,2024-08-15 00:09:02.307,10.8.15.133,10.8.15.4,TCP,54,49680  >  88 [ACK] Seq=333 Ack=1844 Win=262656 Len=0
176,2.307841,2024-08-15 00:09:02.307,10.8.15.4,10.8.15.133,TCP,54,88  >  49679 [ACK] Seq=241 Ack=254 Win=2097664 Len=0
177,2.307843,2024-08-15 00:09:02.307,10.8.15.133,10.8.15.4,TCP,54,"49680  >  88 [FIN, ACK] Seq=333 Ack=1844 Win=262656 Len=0"
178,2.308041,2024-08-15 00:09:02.308,10.8.15.4,10.8.15.133,TCP,54,88  >  49680 [ACK] Seq=1844 Ack=334 Win=2097664 Len=0
179,2.308162,2024-08-15 00:09:02.308,10.8.15.4,10.8.15.133,TCP,54,"88  >  49679 [RST, ACK] Seq=241 Ack=254 Win=0 Len=0"
180,2.308255,2024-08-15 00:09:02.308,10.8.15.4,10.8.15.133,TCP,54,"88  >  49680 [RST, ACK] Seq=1844 Ack=334 Win=0 Len=0"
181,2.315099,2024-08-15 00:09:02.315,10.8.15.133,10.8.15.4,TCP,66,49681  >  88 [SYN] Seq=0 Win=64240 Len=0 MSS=1460 WS=256 SACK_PERM
182,2.315213,2024-08-15 00:09:02.315,10.8.15.4,10.8.15.133,TCP,66,"88  >  49681 [SYN, ACK] Seq=0 Ack=1 Win=65535 Len=0 MSS=1460 WS=256 SACK_PERM"
183,2.315517,2024-08-15 00:09:02.315,10.8.15.133,10.8.15.4,TCP,66,49682  >  49669 [SYN] Seq=0 Win=64240 Len=0 MSS=1460 WS=256 SACK_PERM
184,2.315618,2024-08-15 00:09:02.315,10.8.15.4,10.8.15.133,TCP,66,"49669  >  49682 [SYN, ACK] Seq=0 Ack=1 Win=65535 Len=0 MSS=1460 WS=256 SACK_PERM"
185,2.315701,2024-08-15 00:09:02.315,10.8.15.133,10.8.15.4,TCP,66,49683  >  58963 [SYN] Seq=0 Win=64240 Len=0 MSS=1460 WS=256 SACK_PERM
186,2.315925,2024-08-15 00:09:02.315,10.8.15.4,10.8.15.133,TCP,66,"58963  >  49683 [SYN, ACK] Seq=0 Ack=1 Win=65535 Len=0 MSS=1460 WS=256 SACK_PERM"
187,2.316619,2024-08-15 00:09:02.316,10.8.15.133,10.8.15.4,KRB5,386,AS-REQ
188,2.316634,2024-08-15 00:09:02.316,10.8.15.133,10.8.15.4,TCP,54,49682  >  49669 [ACK] Seq=1 Ack=1 Win=262656 Len=0
189,2.316651,2024-08-15 00:09:02.316,10.8.15.133,10.8.15.4,TCP,54,49683  >  58963 [ACK] Seq=1 Ack=1 Win=262656 Len=0
190,2.316669,2024-08-15 00:09:02.316,10.8.15.133,10.8.15.4,DCERPC,214,"Bind: call_id: 2, Fragment: Single, 3 context items: RPC_NETLOGON V1.0 (32bit NDR), RPC_NETLOGON V1.0 (64bit NDR), RPC_NETLOGON V1.0 (6cb71c2c-9812-4540-0300-000000000000)"
191,2.317085,2024-08-15 00:09:02.317,10.8.15.4,10.8.15.133,DCERPC,162,"Bind_ack: call_id: 2, Fragment: Single, max_xmit: 5840 max_recv: 5840, 3 results: Provider rejection, Acceptance, Negotiate ACK"
192,2.317438,2024-08-15 00:09:02.317,10.8.15.133,10.8.15.4,TCP,66,49684  >  88 [SYN] Seq=0 Win=64240 Len=0 MSS=1460 WS=256 SACK_PERM
193,2.317728,2024-08-15 00:09:02.317,10.8.15.4,10.8.15.133,TCP,66,"88  >  49684 [SYN, ACK] Seq=0 Ack=1 Win=65535 Len=0 MSS=1460 WS=256 SACK_PERM"
194,2.317868,2024-08-15 00:09:02.317,10.8.15.4,10.8.15.133,TCP,1514,88  >  49681 [ACK] Seq=1 Ack=333 Win=2097664 Len=1460 [TCP PDU reassembled in 195]
195,2.31787,2024-08-15 00:09:02.317,10.8.15.4,10.8.15.133,KRB5,437,AS-REP
196,2.317932,2024-08-15 00:09:02.317,10.8.15.133,10.8.15.4,RPC_NETLOGON,254,"NetrServerReqChallenge request, "
197,2.318215,2024-08-15 00:09:02.318,10.8.15.133,10.8.15.4,TCP,54,49684  >  88 [ACK] Seq=1 Ack=1 Win=262656 Len=0
198,2.318272,2024-08-15 00:09:02.318,10.8.15.4,10.8.15.133,RPC_NETLOGON,90,NetrServerReqChallenge response
199,2.31828,2024-08-15 00:09:02.318,10.8.15.133,10.8.15.4,TCP,54,"49681  >  88 [FIN, ACK] Seq=333 Ack=1844 Win=262656 Len=0"
200,2.318429,2024-08-15 00:09:02.318,10.8.15.133,10.8.15.4,KRB5,306,AS-REQ
201,2.318476,2024-08-15 00:09:02.318,10.8.15.4,10.8.15.133,TCP,54,88  >  49681 [ACK] Seq=1844 Ack=334 Win=2097664 Len=0
202,2.318581,2024-08-15 00:09:02.318,10.8.15.4,10.8.15.133,TCP,54,"88  >  49681 [RST, ACK] Seq=1844 Ack=334 Win=0 Len=0"
203,2.318935,2024-08-15 00:09:02.318,10.8.15.4,10.8.15.133,KRB5,294,KRB Error: KRB5KDC_ERR_PREAUTH_REQUIRED
204,2.319205,2024-08-15 00:09:02.319,10.8.15.133,10.8.15.4,TCP,66,49685  >  88 [SYN] Seq=0 Win=64240 Len=0 MSS=1460 WS=256 SACK_PERM
205,2.319467,2024-08-15 00:09:02.319,10.8.15.4,10.8.15.133,TCP,66,"88  >  49685 [SYN, ACK] Seq=0 Ack=1 Win=65535 Len=0 MSS=1460 WS=256 SACK_PERM"
206,2.319782,2024-08-15 00:09:02.319,10.8.15.133,10.8.15.4,RPC_NETLOGON,322,NetrServerAuthenticate3 request
207,2.319821,2024-08-15 00:09:02.319,10.8.15.133,10.8.15.4,TCP,54,"49684  >  88 [FIN, ACK] Seq=253 Ack=241 Win=262400 Len=0"
208,2.319997,2024-08-15 00:09:02.319,10.8.15.4,10.8.15.133,TCP,54,88  >  49684 [ACK] Seq=241 Ack=254 Win=2097664 Len=0
209,2.32016,2024-08-15 00:09:02.320,10.8.15.4,10.8.15.133,TCP,54,"88  >  49684 [RST, ACK] Seq=241 Ack=254 Win=0 Len=0"
210,2.320406,2024-08-15 00:09:02.320,10.8.15.133,10.8.15.4,TCP,66,49686  >  88 [SYN] Seq=0 Win=64240 Len=0 MSS=1460 WS=256 SACK_PERM
211,2.320559,2024-08-15 00:09:02.320,10.8.15.4,10.8.15.133,TCP,66,"88  >  49686 [SYN, ACK] Seq=0 Ack=1 Win=65535 Len=0 MSS=1460 WS=256 SACK_PERM"
212,2.320685,2024-08-15 00:09:02.320,10.8.15.4,10.8.15.133,RPC_NETLOGON,98,NetrServerAuthenticate3 response
213,2.328427,2024-08-15 00:09:02.328,10.8.15.133,10.8.15.4,TCP,66,49687  >  88 [SYN] Seq=0 Win=64240 Len=0 MSS=1460 WS=256 SACK_PERM
214,2.328547,2024-08-15 00:09:02.328,10.8.15.133,10.8.15.4,TCP,54,49685  >  88 [ACK] Seq=1 Ack=1 Win=262656 Len=0
215,2.328553,2024-08-15 00:09:02.328,10.8.15.4,10.8.15.133,TCP,66,"88  >  49687 [SYN, ACK] Seq=0 Ack=1 Win=65535 Len=0 MSS=1460 WS=256 SACK_PERM"
216,2.32859,2024-08-15 00:09:02.328,10.8.15.133,10.8.15.4,TCP,1514,49686  >  88 [ACK] Seq=1 Ack=1 Win=262656 Len=1460 [TCP PDU reassembled in 217]
217,2.328592,2024-08-15 00:09:02.328,10.8.15.133,10.8.15.4,KRB5,474,TGS-REQ
218,2.328737,2024-08-15 00:09:02.328,10.8.15.133,10.8.15.4,TCP,1514,49685  >  88 [ACK] Seq=1 Ack=1 Win=262656 Len=1460 [TCP PDU reassembled in 220]
219,2.328738,2024-08-15 00:09:02.328,10.8.15.4,10.8.15.133,TCP,54,88  >  49686 [ACK] Seq=1 Ack=1881 Win=2097920 Len=0
220,2.32874,2024-08-15 00:09:02.328,10.8.15.133,10.8.15.4,KRB5,494,TGS-REQ
221,2.328771,2024-08-15 00:09:02.328,10.8.15.133,10.8.15.4,DCERPC,210,"Alter_context: call_id: 4, Fragment: Single, 1 context items: RPC_NETLOGON V1.0 (64bit NDR)"
222,2.328929,2024-08-15 00:09:02.328,10.8.15.4,10.8.15.133,TCP,54,88  >  49685 [ACK] Seq=1 Ack=1901 Win=2097920 Len=0
223,2.328933,2024-08-15 00:09:02.328,10.8.15.133,10.8.15.4,TCP,54,49687  >  88 [ACK] Seq=1 Ack=1 Win=262656 Len=0
224,2.329088,2024-08-15 00:09:02.329,10.8.15.133,10.8.15.4,KRB5,386,AS-REQ
225,2.329767,2024-08-15 00:09:02.329,10.8.15.4,10.8.15.133,TCP,1514,88  >  49686 [ACK] Seq=1 Ack=1881 Win=2097920 Len=1460 [TCP PDU reassembled in 226]
226,2.32977,2024-08-15 00:09:02.329,10.8.15.4,10.8.15.133,KRB5,447,TGS-REP
227,2.329783,2024-08-15 00:09:02.329,10.8.15.4,10.8.15.133,TCP,1514,88  >  49685 [ACK] Seq=1 Ack=1901 Win=2097920 Len=1460 [TCP PDU reassembled in 228]
228,2.329786,2024-08-15 00:09:02.329,10.8.15.4,10.8.15.133,KRB5,471,TGS-REP
229,2.329953,2024-08-15 00:09:02.329,10.8.15.4,10.8.15.133,DCERPC,130,"Alter_context_resp: call_id: 4, Fragment: Single, max_xmit: 5840 max_recv: 5840, 1 results: Acceptance"
230,2.330545,2024-08-15 00:09:02.330,10.8.15.4,10.8.15.133,TCP,1514,88  >  49687 [ACK] Seq=1 Ack=333 Win=2097664 Len=1460 [TCP PDU reassembled in 231]
231,2.330548,2024-08-15 00:09:02.330,10.8.15.4,10.8.15.133,KRB5,437,AS-REP
232,2.332593,2024-08-15 00:09:02.332,10.8.15.133,10.8.15.4,TCP,54,49685  >  88 [ACK] Seq=1901 Ack=1878 Win=262656 Len=0
233,2.3326,2024-08-15 00:09:02.332,10.8.15.133,10.8.15.4,TCP,54,"49686  >  88 [FIN, ACK] Seq=1881 Ack=1854 Win=262656 Len=0"
234,2.332608,2024-08-15 00:09:02.332,10.8.15.133,10.8.15.4,TCP,54,49687  >  88 [ACK] Seq=333 Ack=1844 Win=262656 Len=0
235,2.332748,2024-08-15 00:09:02.332,10.8.15.4,10.8.15.133,TCP,54,88  >  49686 [ACK] Seq=1854 Ack=1882 Win=2097920 Len=0
236,2.332813,2024-08-15 00:09:02.332,10.8.15.4,10.8.15.133,TCP,54,"88  >  49686 [RST, ACK] Seq=1854 Ack=1882 Win=0 Len=0"
237,2.332817,2024-08-15 00:09:02.332,10.8.15.133,10.8.15.4,TCP,54,"49685  >  88 [FIN, ACK] Seq=1901 Ack=1878 Win=262656 Len=0"
238,2.332942,2024-08-15 00:09:02.332,10.8.15.4,10.8.15.133,TCP,54,88  >  49685 [ACK] Seq=1878 Ack=1902 Win=2097920 Len=0
239,2.332977,2024-08-15 00:09:02.332,10.8.15.4,10.8.15.133,TCP,54,"88  >  49685 [RST, ACK] Seq=1878 Ack=1902 Win=0 Len=0"
240,2.334549,2024-08-15 00:09:02.334,10.8.15.133,10.8.15.4,TCP,66,49688  >  88 [SYN] Seq=0 Win=64240 Len=0 MSS=1460 WS=256 SACK_PERM
241,2.3347,2024-08-15 00:09:02.334,10.8.15.133,10.8.15.4,TCP,54,"49687  >  88 [FIN, ACK] Seq=333 Ack=1844 Win=262656 Len=0"
242,2.334762,2024-08-15 00:09:02.334,10.8.15.4,10.8.15.133,TCP,66,"88  >  49688 [SYN, ACK] Seq=0 Ack=1 Win=65535 Len=0 MSS=1460 WS=256 SACK_PERM"
243,2.334823,2024-08-15 00:09:02.334,10.8.15.4,10.8.15.133,TCP,54,88  >  49687 [ACK] Seq=1844 Ack=334 Win=2097664 Len=0
244,2.334916,2024-08-15 00:09:02.334,10.8.15.4,10.8.15.133,TCP,54,"88  >  49687 [RST, ACK] Seq=1844 Ack=334 Win=0 Len=0"
245,2.335298,2024-08-15 00:09:02.335,10.8.15.133,10.8.15.4,RPC_NETLOGON,350,NetrLogonGetCapabilities request
246,2.335554,2024-08-15 00:09:02.335,10.8.15.4,10.8.15.133,RPC_NETLOGON,174,NetrLogonGetCapabilities response
247,2.341954,2024-08-15 00:09:02.341,10.8.15.133,10.8.15.4,TCP,66,49689  >  88 [SYN] Seq=0 Win=64240 Len=0 MSS=1460 WS=256 SACK_PERM
248,2.342155,2024-08-15 00:09:02.342,10.8.15.4,10.8.15.133,TCP,66,"88  >  49689 [SYN, ACK] Seq=0 Ack=1 Win=65535 Len=0 MSS=1460 WS=256 SACK_PERM"
249,2.348155,2024-08-15 00:09:02.348,10.8.15.133,10.8.15.4,TCP,54,49677  >  135 [ACK] Seq=329 Ack=377 Win=262400 Len=0
250,2.348171,2024-08-15 00:09:02.348,10.8.15.133,10.8.15.4,TCP,54,49678  >  135 [ACK] Seq=329 Ack=449 Win=262144 Len=0
251,2.348243,2024-08-15 00:09:02.348,10.8.15.133,10.8.15.4,TCP,54,49688  >  88 [ACK] Seq=1 Ack=1 Win=262656 Len=0
252,2.348262,2024-08-15 00:09:02.348,10.8.15.133,10.8.15.4,TCP,54,49689  >  88 [ACK] Seq=1 Ack=1 Win=262656 Len=0
253,2.348451,2024-08-15 00:09:02.348,10.8.15.133,10.8.15.4,TCP,1514,49688  >  88 [ACK] Seq=1 Ack=1 Win=262656 Len=1460 [TCP PDU reassembled in 254]
254,2.348454,2024-08-15 00:09:02.348,10.8.15.133,10.8.15.4,KRB5,267,TGS-REQ
255,2.348565,2024-08-15 00:09:02.348,10.8.15.133,10.8.15.4,TCP,1514,49689  >  88 [ACK] Seq=1 Ack=1 Win=262656 Len=1460 [TCP PDU reassembled in 256]
256,2.348566,2024-08-15 00:09:02.348,10.8.15.133,10.8.15.4,KRB5,494,TGS-REQ
257,2.348612,2024-08-15 00:09:02.348,10.8.15.4,10.8.15.133,TCP,54,88  >  49688 [ACK] Seq=1 Ack=1674 Win=2097920 Len=0
258,2.348725,2024-08-15 00:09:02.348,10.8.15.133,10.8.15.4,RPC_NETLOGON,350,NetrLogonGetCapabilities request
259,2.348833,2024-08-15 00:09:02.348,10.8.15.4,10.8.15.133,TCP,54,88  >  49689 [ACK] Seq=1 Ack=1901 Win=2097920 Len=0
260,2.349503,2024-08-15 00:09:02.349,10.8.15.4,10.8.15.133,TCP,1514,88  >  49688 [ACK] Seq=1 Ack=1674 Win=2097920 Len=1460 [TCP PDU reassembled in 261]
261,2.349505,2024-08-15 00:09:02.349,10.8.15.4,10.8.15.133,KRB5,296,TGS-REP
262,2.349709,2024-08-15 00:09:02.349,10.8.15.4,10.8.15.133,RPC_NETLOGON,174,NetrLogonGetCapabilities response
263,2.349925,2024-08-15 00:09:02.349,10.8.15.4,10.8.15.133,TCP,1514,88  >  49689 [ACK] Seq=1 Ack=1901 Win=2097920 Len=1460 [TCP PDU reassembled in 264]
264,2.349926,2024-08-15 00:09:02.349,10.8.15.4,10.8.15.133,KRB5,471,TGS-REP
265,2.349943,2024-08-15 00:09:02.349,10.8.15.133,10.8.15.4,TCP,54,49688  >  88 [ACK] Seq=1674 Ack=1703 Win=262656 Len=0
266,2.350232,2024-08-15 00:09:02.350,10.8.15.133,10.8.15.4,TCP,54,"49688  >  88 [FIN, ACK] Seq=1674 Ack=1703 Win=262656 Len=0"
267,2.350349,2024-08-15 00:09:02.350,10.8.15.4,10.8.15.133,TCP,54,88  >  49688 [ACK] Seq=1703 Ack=1675 Win=2097920 Len=0
268,2.350472,2024-08-15 00:09:02.350,10.8.15.4,10.8.15.133,TCP,54,"88  >  49688 [RST, ACK] Seq=1703 Ack=1675 Win=0 Len=0"
269,2.350987,2024-08-15 00:09:02.350,10.8.15.133,10.8.15.4,TCP,54,49689  >  88 [ACK] Seq=1901 Ack=1878 Win=262656 Len=0
270,2.351272,2024-08-15 00:09:02.351,10.8.15.133,10.8.15.4,TCP,54,"49689  >  88 [FIN, ACK] Seq=1901 Ack=1878 Win=262656 Len=0"
271,2.351401,2024-08-15 00:09:02.351,10.8.15.4,10.8.15.133,TCP,54,88  >  49689 [ACK] Seq=1878 Ack=1902 Win=2097920 Len=0
272,2.351446,2024-08-15 00:09:02.351,10.8.15.4,10.8.15.133,TCP,54,"88  >  49689 [RST, ACK] Seq=1878 Ack=1902 Win=0 Len=0"
273,2.351879,2024-08-15 00:09:02.351,10.8.15.133,10.8.15.4,TCP,1514,49682  >  49669 [ACK] Seq=1 Ack=1 Win=262656 Len=1460 [TCP PDU reassembled in 274]
274,2.351881,2024-08-15 00:09:02.351,10.8.15.133,10.8.15.4,DCERPC,858,"Bind: call_id: 2, Fragment: Single, 3 context items: DRSUAPI V4.0 (32bit NDR), DRSUAPI V4.0 (64bit NDR), DRSUAPI V4.0 (6cb71c2c-9812-4540-0300-000000000000)"
275,2.352081,2024-08-15 00:09:02.352,10.8.15.4,10.8.15.133,TCP,54,49669  >  49682 [ACK] Seq=1 Ack=2265 Win=2097920 Len=0
276,2.352643,2024-08-15 00:09:02.352,10.8.15.4,10.8.15.133,DCERPC,338,"Bind_ack: call_id: 2, Fragment: Single, max_xmit: 5840 max_recv: 5840, 3 results: Provider rejection, Acceptance, Negotiate ACK"
277,2.355448,2024-08-15 00:09:02.355,10.8.15.133,10.8.15.4,RPC_NETLOGON,1038,NetrLogonGetDomainInfo request
278,2.355969,2024-08-15 00:09:02.355,10.8.15.4,10.8.15.133,RPC_NETLOGON,1102,NetrLogonGetDomainInfo response
279,2.356287,2024-08-15 00:09:02.356,10.8.15.133,10.8.15.4,DCERPC,274,"Alter_context: call_id: 2, Fragment: Single, 1 context items: DRSUAPI V4.0 (64bit NDR)"
280,2.356547,2024-08-15 00:09:02.356,10.8.15.4,10.8.15.133,DCERPC,159,"Alter_context_resp: call_id: 2, Fragment: Single, max_xmit: 5840 max_recv: 5840, 1 results: Acceptance"
281,2.358205,2024-08-15 00:09:02.358,10.8.15.133,10.8.15.4,DRSUAPI,322,DsBind request
282,2.358397,2024-08-15 00:09:02.358,10.8.15.4,10.8.15.133,DRSUAPI,258,DsBind response
283,2.358798,2024-08-15 00:09:02.358,10.8.15.133,10.8.15.4,TCP,66,49690  >  389 [SYN] Seq=0 Win=64240 Len=0 MSS=1460 WS=256 SACK_PERM
284,2.358909,2024-08-15 00:09:02.358,10.8.15.4,10.8.15.133,TCP,66,"389  >  49690 [SYN, ACK] Seq=0 Ack=1 Win=65535 Len=0 MSS=1460 WS=256 SACK_PERM"
285,2.359064,2024-08-15 00:09:02.359,10.8.15.133,10.8.15.4,DRSUAPI,338,DsCrackNames request
286,2.359243,2024-08-15 00:09:02.359,10.8.15.133,10.8.15.4,TCP,54,49690  >  389 [ACK] Seq=1 Ack=1 Win=262656 Len=0
287,2.359371,2024-08-15 00:09:02.359,10.8.15.4,10.8.15.133,DRSUAPI,450,DsCrackNames response
288,2.359391,2024-08-15 00:09:02.359,10.8.15.133,10.8.15.4,LDAP,404,"searchRequest(7) ""<ROOT>"" baseObject "
289,2.359653,2024-08-15 00:09:02.359,10.8.15.4,10.8.15.133,TCP,1514,389  >  49690 [ACK] Seq=1 Ack=351 Win=2097664 Len=1460 [TCP PDU reassembled in 290]
290,2.359656,2024-08-15 00:09:02.359,10.8.15.4,10.8.15.133,LDAP,1435,"searchResEntry(7) ""<ROOT>""  | searchResDone(7) success  [1 result]"
291,2.360054,2024-08-15 00:09:02.360,10.8.15.133,10.8.15.4,TCP,54,49690  >  389 [ACK] Seq=351 Ack=2842 Win=262656 Len=0
292,2.360074,2024-08-15 00:09:02.360,10.8.15.133,10.8.15.4,DRSUAPI,338,DsCrackNames request
293,2.360309,2024-08-15 00:09:02.360,10.8.15.4,10.8.15.133,DRSUAPI,418,DsCrackNames response
294,2.360749,2024-08-15 00:09:02.360,10.8.15.133,10.8.15.4,TCP,1514,49690  >  389 [ACK] Seq=351 Ack=2842 Win=262656 Len=1460 [TCP PDU reassembled in 295]
295,2.360751,2024-08-15 00:09:02.360,10.8.15.133,10.8.15.4,LDAP,749,"bindRequest(9) ""<ROOT>"" sasl "
296,2.360849,2024-08-15 00:09:02.360,10.8.15.4,10.8.15.133,TCP,54,389  >  49690 [ACK] Seq=2842 Ack=2506 Win=2097920 Len=0
297,2.360952,2024-08-15 00:09:02.360,10.8.15.133,10.8.15.4,DRSUAPI,194,DsUnbind request
298,2.361086,2024-08-15 00:09:02.361,10.8.15.4,10.8.15.133,DRSUAPI,194,DsUnbind response
299,2.361391,2024-08-15 00:09:02.361,10.8.15.4,10.8.15.133,LDAP,264,bindResponse(9) success 
300,2.363644,2024-08-15 00:09:02.363,10.8.15.133,10.8.15.4,LDAP,191,SASL GSS-API Privacy: payload (73 bytes)
301,2.363663,2024-08-15 00:09:02.363,10.8.15.133,10.8.15.4,EPM,222,"Map request, DRSUAPI, 32bit NDR"
302,2.363837,2024-08-15 00:09:02.363,10.8.15.4,10.8.15.133,LDAP,223,SASL GSS-API Privacy: payload (105 bytes)
303,2.363949,2024-08-15 00:09:02.363,10.8.15.4,10.8.15.133,EPM,322,"Map response, DRSUAPI, 32bit NDR, DRSUAPI, 32bit NDR"
304,2.365091,2024-08-15 00:09:02.365,10.8.15.133,10.8.15.4,LDAP,252,SASL GSS-API Privacy: payload (134 bytes)
305,2.365365,2024-08-15 00:09:02.365,10.8.15.4,10.8.15.133,LDAP,668,SASL GSS-API Privacy: payload (550 bytes)
306,2.365395,2024-08-15 00:09:02.365,10.8.15.133,10.8.15.4,TCP,1514,49682  >  49669 [ACK] Seq=3461 Ack=1494 Win=262656 Len=1460 [TCP PDU reassembled in 307]
307,2.365396,2024-08-15 00:09:02.365,10.8.15.133,10.8.15.4,DCERPC,770,"Alter_context: call_id: 6, Fragment: Single, 1 context items: DRSUAPI V4.0 (64bit NDR)"
308,2.3655,2024-08-15 00:09:02.365,10.8.15.4,10.8.15.133,TCP,54,49669  >  49682 [ACK] Seq=1494 Ack=5637 Win=2097920 Len=0
309,2.365936,2024-08-15 00:09:02.365,10.8.15.4,10.8.15.133,DCERPC,286,"Alter_context_resp: call_id: 6, Fragment: Single, max_xmit: 5840 max_recv: 5840, 1 results: Acceptance"
310,2.36647,2024-08-15 00:09:02.366,10.8.15.133,10.8.15.4,DCERPC,274,"Alter_context: call_id: 6, Fragment: Single, 1 context items: DRSUAPI V4.0 (64bit NDR)"
311,2.366941,2024-08-15 00:09:02.366,10.8.15.4,10.8.15.133,DCERPC,159,"Alter_context_resp: call_id: 6, Fragment: Single, max_xmit: 5840 max_recv: 5840, 1 results: Acceptance"
312,2.370788,2024-08-15 00:09:02.370,10.8.15.133,10.8.15.4,DRSUAPI,258,DsBind request
313,2.371045,2024-08-15 00:09:02.371,10.8.15.4,10.8.15.133,DRSUAPI,258,DsBind response
314,2.379492,2024-08-15 00:09:02.379,10.8.15.133,10.8.15.4,DRSUAPI,338,DsCrackNames request
315,2.379838,2024-08-15 00:09:02.379,10.8.15.4,10.8.15.133,DRSUAPI,450,DsCrackNames response
316,2.381595,2024-08-15 00:09:02.381,10.8.15.133,10.8.15.4,DRSUAPI,194,DsUnbind request
317,2.381749,2024-08-15 00:09:02.381,10.8.15.4,10.8.15.133,DRSUAPI,194,DsUnbind response
